{
  "$schema": "http://json-schema.org/draft-07/schema#",
  "title": "evidence_summary.json",
  "type": "object",
  "required": ["generated_at","branch","files","ai_reports_files"],
  "properties": {
    "generated_at": {"type": "string"},
    "branch": {"type": "string"},
    "recent_commits": {"type": "array", "items": {"type": "string"}},
    "files": {"type": "object"},
    "ai_reports_files": {"type": "array", "items": {"type": "string"}},
    "pytest_summary": {"type": "string"},
    "pytest_exit_code": {"type": "integer"},
    "flake8_summary": {"type": "string"}
  },
  "additionalProperties": true
}
