{
  "ai_reports_files": [
    "ai_reports/ai_report_diffs.md",
    "ai_reports/ai_report_latest.md",
    "ai_reports/baseline_manifest.json",
    "ai_reports/baseline_summary.md",
    "ai_reports/checklist_backups/checklist.md.backup.20251127T115723Z",
    "ai_reports/cross_pillar_integrity.json",
    "ai_reports/evaluator_alignment_plan.json",
    "ai_reports/evaluator_schema_consistency.json",
    "ai_reports/evaluator_schema_detection.json",
    "ai_reports/phase3_activation_gate.json",
    "ai_reports/phase3_activation_roadmap.json",
    "ai_reports/phase3_blocking_matrix.json",
    "ai_reports/phase3_closeout_summary.json",
    "ai_reports/phase3_consolidated_report.md",
    "ai_reports/phase3_execution_plan.json",
    "ai_reports/phase3_execution_schedule.json",
    "ai_reports/phase3_finalization_certificate.md",
    "ai_reports/phase3_pre_activation_checklist.md",
    "ai_reports/phase3_pre_activation_checklist_updated.md",
    "ai_reports/phase3_readiness_gate.json",
    "ai_reports/phase3_unblock_plan.json",
    "ai_reports/phase4_activation_outline.md",
    "ai_reports/phase4_closeout_report.json",
    "ai_reports/phase4_consolidated_briefing.md",
    "ai_reports/phase4_finalization_certificate.md",
    "ai_reports/phase4_seed_evaluator_tasks.json",
    "ai_reports/phase4_seed_rule_tasks.json",
    "ai_reports/phase4_seed_schema_tasks.json",
    "ai_reports/phase5_activation_closeout.json",
    "ai_reports/phase5_activation_plan.json",
    "ai_reports/phase5_activation_precheck.json",
    "ai_reports/phase5_activation_readiness_gate.json",
    "ai_reports/phase5_flake8_raw.txt",
    "ai_reports/phase5_flake8_raw_after.txt",
    "ai_reports/phase5_full_verification.json",
    "ai_reports/phase5_lint_fix_summary.json",
    "ai_reports/phase5_pilot.patch",
    "ai_reports/phase5_pilot_actions.json",
    "ai_reports/phase5_pilot_clean.patch",
    "ai_reports/phase5_pilot_report.json",
    "ai_reports/phase5_pr_patch.json",
    "ai_reports/pillar_evaluator_plan.json",
    "ai_reports/pillar_map.json",
    "ai_reports/pillar_mapping_proposal.json",
    "ai_reports/pillar_readiness_report.json",
    "ai_reports/progress.json",
    "ai_reports/project_completion_percentage.json",
    "ai_reports/rule_coverage_matrix.json",
    "ai_reports/rule_registry_audit.json",
    "ai_reports/rule_spec_alignment.json",
    "ai_reports/schema_coverage_audit.json",
    "ai_reports/schema_readiness_report.json",
    "ai_reports/schema_template_summary.json",
    "ai_reports/schema_template_validation.json",
    "ai_reports/schema_templates/computeguard.schema.yml",
    "ai_reports/schema_templates/computescan.schema.yml",
    "ai_reports/schema_templates/pipelineguard.schema.yml",
    "ai_reports/schema_templates/pipelinescan.schema.yml",
    "ai_reports/schema_templates/vectorguard.schema.yml",
    "ai_reports/schema_templates/vectorscan.schema.yml",
    "ai_reports/structure_audit.json"
  ],
  "branch": "phase5/pilot-computeguard-clean",
  "files": {
    "ai_reports/progress.json": {
      "exists": true,
      "last_commit": null,
      "mtime": "2025-11-27T11:56:19.446901Z"
    },
    "products/computeguard/checklist/checklist.md": {
      "exists": true,
      "last_commit": null,
      "mtime": "2025-11-27T12:01:33.760977Z"
    },
    "products/computeguard/rules/00_base_rule.yml": {
      "exists": true,
      "last_commit": "5b843894d64eaa6d939c17488409d52ed2402192|5b84389|2025-11-27 10:58:49 +0200",
      "mtime": "2025-11-27T08:58:49.807161Z"
    },
    "products/computeguard/schema.yml": {
      "exists": true,
      "last_commit": "5b843894d64eaa6d939c17488409d52ed2402192|5b84389|2025-11-27 10:58:49 +0200",
      "mtime": "2025-11-27T08:58:49.808161Z"
    },
    "strategy_e/adapters/computeguard_adapter.py": {
      "exists": true,
      "last_commit": "541760c6d10b5a2a09c74be0612c17ee304ae629|541760c|2025-11-27 11:22:30 +0200",
      "mtime": "2025-11-27T09:47:17.510632Z"
    },
    "strategy_e/adapters/pipeline_adapter.py": {
      "exists": true,
      "last_commit": "541760c6d10b5a2a09c74be0612c17ee304ae629|541760c|2025-11-27 11:22:30 +0200",
      "mtime": "2025-11-27T09:47:17.565631Z"
    },
    "tools/update_checklist_from_progress.py": {
      "exists": true,
      "last_commit": null,
      "mtime": "2025-11-27T11:58:38.873131Z"
    }
  },
  "flake8_summary": "ai_reports/phase5_flake8_raw_after.txt",
  "generated_at": "2025-11-27T12:03:40.025592Z",
  "pytest_exit_code": 0,
  "pytest_summary": "ai_reports/pytest_summary.txt",
  "recent_commits": [
    "70bc4be 2025-11-27 11:43:14 +0200 ATU-0049: Incremental lint fixes and CI scaffold",
    "d2f5645 2025-11-27 11:26:08 +0200 ATU-0048: Full repo lint capture and top-level adapter test backfill",
    "541760c 2025-11-27 11:22:30 +0200 ATU-0047: Adapter lint fixes and verification",
    "31261c6 2025-11-27 11:11:10 +0200 Phase-5 verification: adapters fixed; tests passed; lint issues recorded",
    "5b84389 2025-11-27 10:58:49 +0200 Phase-5 pilot: promote computeguard schema, update base rule, scaffold adapters",
    "64367e0 2025-11-26 18:13:07 +0200 Strategy-E Phase 28: Add forecasting CI run snapshot (empty fallback)",
    "594c20e 2025-11-26 18:13:02 +0200 Strategy-E Phase 28: Add forecasting CI run snapshot",
    "aff782f 2025-11-26 18:12:55 +0200 Strategy-E Phase 28: Add forecasting CI run snapshot",
    "82216e1 2025-11-26 18:12:48 +0200 Strategy-E Phase 28: Add forecasting CI run snapshot",
    "c6a28da 2025-11-26 18:12:41 +0200 Strategy-E Phase 28: Add forecasting CI run snapshot",
    "fefa56f 2025-11-26 17:21:56 +0200 Strategy-E Phase 27: Trigger CI forecasting workflow verification",
    "ac90415 2025-11-26 16:32:05 +0200 Strategy-E Phase 26: Add CI workflow for forecasting tests",
    "578d6aa 2025-11-26 15:45:06 +0200 Strategy-E Phase 25: Add forecasting tests and tools documentation",
    "f4aa4ec 2025-11-26 15:28:48 +0200 Strategy-E Phase 24: Predictive drift forecasting & risk modeling",
    "0596aec 2025-11-26 15:23:39 +0200 Strategy-E Phase 23: Drift budgets & alert threshold engine",
    "0e350d9 2025-11-26 15:15:05 +0200 Strategy-E Phase 22: Temporal drift snapshot history engine & reports",
    "47b99d0 2025-11-26 15:11:51 +0200 Strategy-E Phase 21: Lineage-aware drift attribution engine and reports",
    "dc519d0 2025-11-26 15:04:05 +0200 Strategy-E Phase 20: Implement drift-comparison engine and generate drift report",
    "f1d8749 2025-11-26 15:00:32 +0200 Strategy-E Phase 19: Add deterministic SHA-256 integrity checksums",
    "54dc29c 2025-11-26 13:53:20 +0200 Strategy-E Phase 18: Generate Canonical Cross-Product State Manifest",
    "a4ee4eb 2025-11-26 13:49:00 +0200 Strategy-E Phase 17b: Validation Integrity Snapshot",
    "7c1fdb3 2025-11-26 13:05:36 +0200 Merge pull request #1 from Dee66/feature/repair-runner",
    "8015480 2025-11-26 12:54:29 +0200 Strategy-E: Repair Runner Integration",
    "cdbced9 2025-11-26 12:50:33 +0200 Strategy-E Phase 14: Add custom backup directory tests",
    "0a1a496 2025-11-26 12:42:46 +0200 Strategy-E Phase 13: Implement real repairs, dry-run mode, and backup tests",
    "198b38c 2025-11-26 12:38:33 +0200 Strategy-E Phase 12: Implement repair execution with deterministic backups and reversible writes",
    "3409193 2025-11-26 12:34:47 +0200 Strategy-E Phase 11: Add deterministic unified diff engine and integrate into pipeline",
    "edf69d6 2025-11-26 12:29:12 +0200 Strategy-E Phase 10: Implement rule-spec execution pipeline scaffolding",
    "12af9f0 2025-11-26 12:25:22 +0200 Strategy-E Phase 9: Add CI badge for rule-spec validation",
    "0f69872 2025-11-26 12:22:53 +0200 Strategy-E Phase 8: Add strict rule-spec validation rules and tests",
    "1db9270 2025-11-26 12:18:36 +0200 Strategy-E Phase 7: Add CI workflow for rule-spec validation",
    "39ea220 2025-11-26 12:15:12 +0200 Strategy-E Phase 6: Full rule-spec validation report",
    "ef27cc9 2025-11-26 12:00:28 +0200 Strategy-E Phase 5: Add lightweight rule-spec validator and tests",
    "96c0d46 2025-11-26 11:56:20 +0200 Strategy-E Phase 4: Rule-spec scaffolding creation",
    "867c20c 2025-11-26 11:50:21 +0200 Strategy-E Phase 3: Expand design notes and add Phase 3 plan",
    "6c40284 2025-11-26 09:59:55 +0200 Strategy-E Phase 2: Populate test summary placeholders",
    "445eee0 2025-11-26 09:57:43 +0200 Strategy-E Phase 2: Full test-suite execution report",
    "c019780 2025-11-26 09:51:31 +0200 Strategy-E Phase 2: Scaffold initial real normalization rules",
    "5cc0b02 2025-11-26 09:51:02 +0200 Strategy-E Phase 2: Scaffold normalization rules and rule-aware runner",
    "8b5ff3e 2025-11-26 09:45:25 +0200 feat(repair-runner): add directory processing + incremental rule loading and tests",
    "d38db4a 2025-11-26 09:40:44 +0200 feat(repair-runner): scaffold minimal deterministic repair runner + tests",
    "d92c9dc 2025-11-26 09:38:55 +0200 Strategy-E Phase 3: Implementation plan",
    "081082b 2025-11-26 09:35:42 +0200 AI-Dev: Add JSON copy and Strategy-E Phase 3 scaffolding",
    "19e155f 2025-11-26 09:35:40 +0200 AI-Dev: Add JSON diagnostic export (v33) - regen",
    "c3453cf 2025-11-26 09:31:33 +0200 AI-Dev: Add unified diffs for untracked files (v33)",
    "bfd3fb9 2025-11-26 09:29:27 +0200 AI-Dev: Add JSON diagnostic export (v33)",
    "7db9fbe 2025-11-26 09:24:57 +0200 AI-Dev: Repository Scan Report Update (v33)",
    "3fd2c1f 2025-11-26 09:18:16 +0200 Strategy-E Phase 2: Expanded design, analysis, and alignment scaffolding",
    "4dd2297 2025-11-26 09:13:08 +0200 Strategy-E Phase 1: Planning and bootstrap initialization",
    "164d32f 2025-11-26 09:10:33 +0200 Strategy-D Phase 14: Final completion summary"
  ]
}